{
  "schema": "oilwell.telemetry.v1",
  "message_id": "example-20260923-000001",
  "gateway_id": "GW-EXAMPLE",
  "device_id": "D-EXAMPLE",
  "boot_id": "example-boot-0001",
  "created_at": "2026-09-23T08:00:00Z",
  "sequence": {"first": 1, "last": 1},
  "samples": [
    {"point": "motor.active_power", "measured_at": "2026-09-23T08:00:00Z", "sequence": 1, "value": 5.8, "quality": "good", "unit": "kW", "source": "modbus-tcp"},
    {"point": "motor.current", "measured_at": "2026-09-23T08:00:00Z", "sequence": 1, "value": 12.5, "quality": "good", "unit": "A", "source": "modbus-tcp"},
    {"point": "motor.speed", "measured_at": "2026-09-23T08:00:00Z", "sequence": 1, "value": 1234.5, "quality": "good", "unit": "rpm", "source": "modbus-tcp"}
  ]
}
